{
  "opendb_id": "ed5d68c1-023d-4eef-9b2e-76329fd483f6",
  "metadata": {
    "name": "Asus ROG STRIX LC III ARGB Water 360mm ARGB 70.38 CFM White",
    "manufacturer": "Asus",
    "part_numbers": [
      "ROG Strix LC III 360 ARGB WHT"
    ],
    "series": "ROG",
    "variant": "White",
    "releaseYear": null
  },
  "min_fan_rpm": 800,
  "max_fan_rpm": 2200,
  "min_noise_level": 36,
  "max_noise_level": null,
  "color": [
    "WHITE"
  ],
  "height": null,
  "cpu_sockets": [
    "AM4",
    "AM5",
    "LGA1150",
    "LGA1151",
    "LGA1155",
    "LGA1156",
    "LGA1200",
    "LGA1700",
    "LGA1851"
  ],
  "water_cooled": true,
  "radiator_size": 360,
  "fanless": false,
  "fan_size": null,
  "fan_quantity": null,
  "general_product_information": {
    "amazon_sku": "B0CXLTXTTX",
    "newegg_sku": "N82E16835101106",
    "walmart_sku": 5389834702
  }
}