{
  "opendb_id": "175c2034-adef-4a41-a5c7-0092e12d6194",
  "metadata": {
    "name": "Deepcool LE720 Water 360mm Black",
    "manufacturer": "Deepcool",
    "part_numbers": [
      "R-LE720-BKAMMN-G-1"
    ],
    "series": "LE720",
    "variant": "Black",
    "releaseYear": null
  },
  "min_fan_rpm": 500,
  "max_fan_rpm": 2250,
  "min_noise_level": 32.9,
  "max_noise_level": null,
  "color": [
    "BLACK"
  ],
  "height": 52,
  "cpu_sockets": [
    "AM4",
    "AM5",
    "LGA1150",
    "LGA1151",
    "LGA1155",
    "LGA1156",
    "LGA1200",
    "LGA1700",
    "LGA1851"
  ],
  "water_cooled": true,
  "radiator_size": 360,
  "fanless": false,
  "fan_size": null,
  "fan_quantity": null,
  "general_product_information": {}
}