{
  "opendb_id": "9e8996cd-e0c8-409c-9ec9-c60f08980b32",
  "metadata": {
    "name": "Enermax AQUAFUSION ADV Water 240mm 79.8 CFM Black",
    "manufacturer": "Enermax",
    "part_numbers": [
      "ELC-AQFA240-SQA"
    ],
    "series": "AQUAFUSION",
    "variant": "Black",
    "releaseYear": null
  },
  "min_fan_rpm": 500,
  "max_fan_rpm": 2000,
  "min_noise_level": 15,
  "max_noise_level": 32.6,
  "color": [
    "BLACK"
  ],
  "height": 54,
  "cpu_sockets": [
    "AM2AM2",
    "AM3AM3",
    "AM4AM5FM1FM2FM2",
    "LGA1150LGA1151LGA1155LGA1156LGA1200LGA1366LGA1700LGA2011LGA2011",
    "3LGA2066"
  ],
  "water_cooled": true,
  "radiator_size": 240,
  "fanless": false,
  "fan_size": null,
  "fan_quantity": null,
  "general_product_information": {
    "amazon_sku": "B0BJ111V2Y",
    "newegg_sku": "9SIAFH7K5C5038",
    "walmart_sku": 1779448245
  }
}