{
  "opendb_id": "dde60b57-af03-465a-a08c-817810337c34",
  "metadata": {
    "name": "Iceberg Thermal IceFLOE T65 Air 38mm Silver / Teal",
    "manufacturer": "Iceberg Thermal",
    "part_numbers": [
      "ICEFLOE65-00A"
    ],
    "series": "IceFLOE",
    "variant": "Silver / Teal",
    "releaseYear": null
  },
  "min_fan_rpm": 1000,
  "max_fan_rpm": 3000,
  "min_noise_level": 31.5,
  "max_noise_level": null,
  "color": [
    "GREY",
    "BLUE"
  ],
  "height": 38,
  "cpu_sockets": [
    "AM2",
    "AM2",
    "AM3",
    "AM3",
    "AM4",
    "AM5",
    "FM1",
    "FM2",
    "FM2",
    "LGA775",
    "LGA1150",
    "LGA1151",
    "LGA1155",
    "LGA1156",
    "LGA1200",
    "LGA1366"
  ],
  "water_cooled": false,
  "radiator_size": null,
  "fanless": false,
  "fan_size": null,
  "fan_quantity": null,
  "general_product_information": {}
}