{
  "opendb_id": "add3bdae-860c-44ae-8109-40a93265ecd7",
  "metadata": {
    "name": "Jonsbo CR-1000 Air 158mm 66.81 CFM White",
    "manufacturer": "Jonsbo",
    "part_numbers": [
      "CR-1000 White"
    ],
    "series": "CR-1000",
    "variant": "White",
    "releaseYear": null
  },
  "min_fan_rpm": 700,
  "max_fan_rpm": 1800,
  "min_noise_level": 20.55,
  "max_noise_level": 37.2,
  "color": [
    "WHITE"
  ],
  "height": 158,
  "cpu_sockets": [
    "AM4",
    "AM5",
    "LGA1150",
    "LGA1151",
    "LGA1155",
    "LGA1156",
    "LGA1200",
    "LGA1700",
    "LGA1851"
  ],
  "water_cooled": false,
  "radiator_size": null,
  "fanless": false,
  "fan_size": null,
  "fan_quantity": null,
  "general_product_information": {}
}