{
  "opendb_id": "2fab0617-343c-4754-a321-f04b366d42d9",
  "metadata": {
    "name": "MSI MAG CORELIQUID 360R V2 Water 360mm White",
    "manufacturer": "MSI",
    "part_numbers": [
      "MAG CORELIQUID 360R V2 WHITE306-7ZW1B53-813"
    ],
    "series": "MAG",
    "variant": "White",
    "releaseYear": null
  },
  "min_fan_rpm": 500,
  "max_fan_rpm": 2000,
  "min_noise_level": 14.3,
  "max_noise_level": 34.3,
  "color": [
    "WHITE"
  ],
  "height": null,
  "cpu_sockets": [
    "AM2AM2",
    "AM3AM3",
    "AM4AM5sTR4sTRX4FM1FM2FM2",
    "LGA1150LGA1151LGA1155LGA1156LGA1200LGA1366LGA1700"
  ],
  "water_cooled": true,
  "radiator_size": 360,
  "fanless": false,
  "fan_size": null,
  "fan_quantity": null,
  "general_product_information": {
    "amazon_sku": "B0B45MDFXH"
  }
}