{
  "opendb_id": "010abcce-a3d8-488c-a89d-9713092820c1",
  "metadata": {
    "name": "Deepcool AK400 Air 155mm Black / Silver",
    "manufacturer": "Deepcool",
    "part_numbers": [
      "R-AK400-BKNNMN-G-1"
    ],
    "series": "AK400",
    "variant": "Black / Silver",
    "releaseYear": null
  },
  "min_fan_rpm": 500,
  "max_fan_rpm": 1850,
  "min_noise_level": 29,
  "max_noise_level": null,
  "color": [
    "BLACK",
    "GREY"
  ],
  "height": 155,
  "cpu_sockets": [
    "AM4",
    "AM5",
    "LGA1150",
    "LGA1151",
    "LGA1155",
    "LGA1156",
    "LGA1200",
    "LGA1700",
    "LGA1851"
  ],
  "water_cooled": false,
  "radiator_size": null,
  "fanless": false,
  "fan_size": null,
  "fan_quantity": null,
  "general_product_information": {}
}