{
  "opendb_id": "faf70b02-c080-4305-92f4-715defbbe3fc",
  "metadata": {
    "name": "Cooler Master MasterAIR G200P Air 39mm Black / Silver",
    "manufacturer": "Cooler Master",
    "part_numbers": [
      "MAP-G2PN-126PC-R1"
    ],
    "series": "MasterAIR",
    "variant": "Black / Silver",
    "releaseYear": null
  },
  "min_fan_rpm": 800,
  "max_fan_rpm": 2000,
  "min_noise_level": 6,
  "max_noise_level": 28,
  "color": [
    "BLACK",
    "GREY"
  ],
  "height": 39,
  "cpu_sockets": [
    "AM2",
    "AM2",
    "AM3",
    "AM3",
    "AM4",
    "FM1",
    "FM2",
    "FM2",
    "LGA1150",
    "LGA1151",
    "LGA1155",
    "LGA1156",
    "LGA1200"
  ],
  "water_cooled": false,
  "radiator_size": null,
  "fanless": false,
  "fan_size": null,
  "fan_quantity": null,
  "general_product_information": {
    "amazon_sku": "B082WZDY8B",
    "walmart_sku": 654429577
  }
}