{
  "opendb_id": "763ae303-ad6d-43d3-8793-1ca11886f6b3",
  "metadata": {
    "name": "ID-COOLING DASHFLOW BASIC Water 360mm 82.5 CFM Black",
    "manufacturer": "ID-COOLING",
    "part_numbers": [
      "DASHFLOW 360 BASIC BLACK"
    ],
    "series": "DASHFLOW",
    "variant": "Black",
    "releaseYear": null
  },
  "min_fan_rpm": 700,
  "max_fan_rpm": 1800,
  "min_noise_level": 15.2,
  "max_noise_level": 35.2,
  "color": [
    "BLACK"
  ],
  "height": null,
  "cpu_sockets": [
    "AM4",
    "AM5",
    "LGA1150",
    "LGA1151",
    "LGA1155",
    "LGA1156",
    "LGA1200",
    "LGA1700",
    "LGA1851",
    "LGA2011",
    "LGA2011",
    "3",
    "LGA2066"
  ],
  "water_cooled": true,
  "radiator_size": 360,
  "fanless": false,
  "fan_size": null,
  "fan_quantity": null,
  "general_product_information": {}
}