{
  "opendb_id": "89c947e7-726e-4555-924e-ad26e446d96e",
  "metadata": {
    "name": "Scythe BIG Shuriken 2 Rev. B 45.47 CFM Sleeve Bearing Air 58mm",
    "manufacturer": "Scythe",
    "part_numbers": [
      "SCBSK-2100"
    ],
    "series": "BIG",
    "variant": "",
    "releaseYear": null
  },
  "min_fan_rpm": 500,
  "max_fan_rpm": 2000,
  "min_noise_level": 9.32,
  "max_noise_level": 33.67,
  "color": [],
  "height": 58,
  "cpu_sockets": [
    "AM2",
    "AM2",
    "AM3",
    "AM3",
    "FM1",
    "FM2",
    "FM2",
    "LGA775",
    "LGA1150",
    "LGA1151",
    "LGA1155",
    "LGA1156",
    "LGA1200",
    "LGA1366",
    "LGA2011",
    "LGA2011",
    "3",
    "LGA2066"
  ],
  "water_cooled": false,
  "radiator_size": null,
  "fanless": false,
  "fan_size": null,
  "fan_quantity": null,
  "general_product_information": {}
}