{
  "opendb_id": "f7279b2c-59d3-48a6-847a-10c94643dfef",
  "metadata": {
    "name": "MSI MEG CORELIQUID S280 Water 280mm Black",
    "manufacturer": "MSI",
    "part_numbers": [
      "MEG CoreLiquid S280                                                    9S6-6A0431-001                                                    CLS280"
    ],
    "series": "MEG",
    "variant": "Black",
    "releaseYear": null
  },
  "min_fan_rpm": null,
  "max_fan_rpm": null,
  "min_noise_level": 24.9,
  "max_noise_level": null,
  "color": [
    "BLACK"
  ],
  "height": null,
  "cpu_sockets": [
    "AM2",
    "AM2",
    "AM3",
    "AM3",
    "AM4",
    "AM5",
    "FM1",
    "FM2",
    "FM2",
    "LGA1150",
    "LGA1151",
    "LGA1155",
    "LGA1156",
    "LGA1200",
    "LGA1700",
    "LGA1851",
    "LGA2011",
    "LGA2011",
    "3",
    "LGA2066"
  ],
  "water_cooled": true,
  "radiator_size": 280,
  "fanless": false,
  "fan_size": null,
  "fan_quantity": null,
  "general_product_information": {
    "amazon_sku": "B09CQCX4VM",
    "newegg_sku": "N82E16835846028",
    "walmart_sku": 961306141
  }
}