{
  "opendb_id": "b5698f15-3da1-4ed1-86b8-0e4cd7abd148",
  "metadata": {
    "name": "NZXT Kraken X73 Water 360mm 73.11 CFM Black",
    "manufacturer": "NZXT",
    "part_numbers": [
      "RL-KRX73-01"
    ],
    "series": "Kraken",
    "variant": "Black",
    "releaseYear": null
  },
  "min_fan_rpm": 500,
  "max_fan_rpm": 2000,
  "min_noise_level": 21,
  "max_noise_level": 36,
  "color": [
    "BLACK"
  ],
  "height": null,
  "cpu_sockets": [
    "AM4",
    "AM5",
    "sTR4",
    "sTRX4",
    "LGA1150",
    "LGA1151",
    "LGA1155",
    "LGA1156",
    "LGA1200",
    "LGA1366",
    "LGA1700",
    "LGA1851",
    "LGA2011",
    "LGA2011",
    "3",
    "LGA2066"
  ],
  "water_cooled": true,
  "radiator_size": 360,
  "fanless": false,
  "fan_size": null,
  "fan_quantity": null,
  "general_product_information": {
    "amazon_sku": "B082DYKB1F",
    "newegg_sku": "9SIAWKTJSV6878",
    "bestbuy_sku": 6408511,
    "walmart_sku": 436594045
  }
}