{
  "opendb_id": "93c679ad-ceb6-4d92-b381-3a638396a8cd",
  "metadata": {
    "name": "ID-COOLING SE-903-XT Air 45.8 CFM",
    "manufacturer": "ID-COOLING",
    "part_numbers": [
      "SE-903-XT"
    ],
    "series": "SE-903-XT",
    "variant": "",
    "releaseYear": null
  },
  "min_fan_rpm": 500,
  "max_fan_rpm": 2200,
  "min_noise_level": 14,
  "max_noise_level": 25.8,
  "color": [],
  "height": 123,
  "cpu_sockets": [
    "AM4",
    "AM5",
    "LGA1150",
    "LGA1151",
    "LGA1155",
    "LGA1156",
    "LGA1200",
    "LGA1700",
    "LGA1851"
  ],
  "water_cooled": false,
  "radiator_size": null,
  "fanless": false,
  "fan_size": null,
  "fan_quantity": null,
  "general_product_information": {}
}