{
  "opendb_id": "dd0d6342-6268-468a-a172-4ee15e6a8683",
  "metadata": {
    "name": "Thermalright Frozen Magic Scenic V2 Water 280mm 110.4 CFM White",
    "manufacturer": "Thermalright",
    "part_numbers": [
      "Frozen Magic 280 Scenic V2"
    ],
    "series": "Frozen",
    "variant": "White",
    "releaseYear": null
  },
  "min_fan_rpm": 2000,
  "max_fan_rpm": null,
  "min_noise_level": 31.4,
  "max_noise_level": null,
  "color": [
    "WHITE"
  ],
  "height": null,
  "cpu_sockets": [
    "AM2",
    "AM2",
    "AM3",
    "AM3",
    "AM4",
    "AM5",
    "FM1",
    "FM2",
    "FM2",
    "LGA1150",
    "LGA1151",
    "LGA1155",
    "LGA1156",
    "LGA1200",
    "LGA1700",
    "LGA1851",
    "LGA2011",
    "LGA2011",
    "3",
    "LGA2066"
  ],
  "water_cooled": true,
  "radiator_size": 280,
  "fanless": false,
  "fan_size": null,
  "fan_quantity": null,
  "general_product_information": {
    "amazon_sku": "B0BBLY7KQH"
  }
}