{
  "opendb_id": "87766b61-5dfb-4367-8279-e1be080dbf11",
  "metadata": {
    "name": "ID-COOLING PINKFLOW Water 360mm 55.2 CFM Pink",
    "manufacturer": "ID-COOLING",
    "part_numbers": [
      "PINKFLOW 360"
    ],
    "series": "PINKFLOW",
    "variant": "Pink",
    "releaseYear": null
  },
  "min_fan_rpm": 900,
  "max_fan_rpm": 2000,
  "min_noise_level": 16.3,
  "max_noise_level": 33.5,
  "color": [
    "PINK"
  ],
  "height": null,
  "cpu_sockets": [
    "AM4",
    "AM5",
    "LGA1150",
    "LGA1151",
    "LGA1155",
    "LGA1156",
    "LGA1200",
    "LGA1700",
    "LGA1851",
    "LGA2011",
    "LGA2011",
    "3",
    "LGA2066"
  ],
  "water_cooled": true,
  "radiator_size": 360,
  "fanless": false,
  "fan_size": null,
  "fan_quantity": null,
  "general_product_information": {}
}