{
  "opendb_id": "8ef1437e-07de-4e6e-bdf6-189422ec42df",
  "metadata": {
    "name": "MasterLiquid ML120L V2 RGB",
    "manufacturer": "Cooler Master",
    "part_number": "MLW-D12M-A18PC-R2",
    "series": "MasterLiquid Lite",
    "variant": "RGB",
    "releaseYear": 2020,
    "part_numbers": []
  },
  "min_fan_rpm": 650,
  "max_fan_rpm": 1800,
  "min_noise_level": null,
  "max_noise_level": 10,
  "height": null,
  "cpu_sockets": [
    "Intel® LGA 1851",
    "Intel® LGA 1700",
    "Intel® LGA 1200",
    "Intel® LGA 2066",
    "Intel® LGA 2011-v3",
    "Intel® LGA 2011",
    "Intel® LGA 1151",
    "Intel® LGA 1150",
    "Intel® LGA 1155",
    "Intel® LGA 1156",
    "AMD® AM5",
    "AMD® AM4"
  ],
  "water_cooled": true,
  "radiator_size": 120,
  "fanless": false,
  "fan_size": 120,
  "fan_quantity": 1,
  "color": [],
  "general_product_information": {
    "amazon_sku": "B075XLX31G",
    "newegg_sku": "13C-000X-003C1",
    "walmart_sku": 906446322
  }
}